root@m1120-c46ab:~# i2cdump -y -a 15 0x60
No size specified (using byte-data access)
     0  1  2  3  4  5  6  7  8  9  a  b  c  d  e  f    0123456789abcdef
00: 36 01 01 0f 03 00 00 00 86 cd 09 ff 1b 00 00 00    6????...???.?...
10: bf be eb f8 ff ff ff f7 9f 0f 00 00 00 00 00 00    ????...???......
20: 63 4c de ce 7f 0d 00 00 fe 1f 00 00 00 00 00 00    cL????..??......
30: 00 00 f9 0b 00 00 00 00 00 00 00 00 00 00 00 00    ..??............
40: 10 00 00 00 00 00 00 00 00 00 00 00 00 00 00 00    ?...............
50: 00 00 00 00 00 00 00 00 00 00 00 00 00 00 00 00    ................
60: 00 00 00 00 00 00 00 00 00 00 00 00 00 00 00 00    ................
70: 00 00 00 00 00 00 00 00 00 00 00 00 00 00 00 00    ................
80: 00 00 00 00 00 00 00 00 00 00 00 00 00 00 00 00    ................
90: 00 00 00 00 00 00 00 00 00 00 00 00 00 00 00 00    ................
a0: 00 00 00 00 00 00 00 00 00 00 00 00 00 00 00 00    ................
b0: 00 00 00 00 00 00 00 00 00 00 00 00 00 00 00 00    ................
c0: 00 00 00 00 00 00 00 00 00 00 00 00 00 00 00 00    ................
d0: 00 00 00 00 00 00 00 00 00 00 00 00 00 00 00 00    ................
e0: 00 00 00 00 00 00 00 00 00 00 00 00 00 00 00 00    ................
f0: 00 03 06 00 07 18 25 00 00 00 00 00 00 00 00 00    .??.??%.........
root@m1120-c46ab:~# i2cdump -y -a 5 0x30
No size specified (using byte-data access)
     0  1  2  3  4  5  6  7  8  9  a  b  c  d  e  f    0123456789abcdef
00: 00 00 c3 0c 03 80 00 03 00 ff fe 00 00 fc 00 00    ..????.?..?..?..
10: ff c0 fe c0 ff ff 00 00 00 00 00 60 60 a0 a0 f0    .???.......``???
20: f0 f0 f0 00 00 e0 00 00 00 00 00 00 00 03 0f 00    ???..?.......??.
30: 00 00 00 00 00 00 00 00 00 00 00 00 00 00 00 00    ................
40: 80 00 00 00 00 00 00 00 00 00 00 00 00 00 00 00    ?...............
50: 3f c0 00 00 00 00 00 00 00 00 00 00 00 00 00 00    ??..............
60: e0 00 00 ff 00 00 67 f9 ff ff fc 00 00 00 00 00    ?.....g?..?.....
70: 00 00 00 00 00 00 00 00 f0 00 00 c0 00 00 7b 00    ........?..?..{.
80: 00 cf 00 00 e0 00 00 c0 00 00 00 00 00 00 00 00    .?..?..?........
90: 00 00 00 00 00 00 00 00 00 00 00 00 80 00 01 08    ............?.??
a0: 4f 90 40 55 fc ff c0 00 03 00 66 00 9b 01 00 00    O?@U?.?.?.f.??..
b0: 10 00 00 00 00 00 00 00 00 00 00 00 00 00 00 00    ?...............
c0: 00 00 00 00 00 00 00 00 00 00 00 00 00 00 00 00    ................
d0: 00 00 00 00 69 00 00 fe 00 00 00 00 00 00 00 00    ....i..?........
e0: 00 00 00 00 00 00 00 00 00 00 00 00 00 00 00 00    ................
f0: 00 00 00 00 00 00 00 00 00 00 00 00 00 00 02 0a    ..............??
root@m1120-c46ab:~# i2cdump -y -a 5 0x31
No size specified (using byte-data access)
     0  1  2  3  4  5  6  7  8  9  a  b  c  d  e  f    0123456789abcdef
00: 00 05 10 0c 01 00 00 00 00 00 00 00 00 00 00 00    .????...........
10: 00 00 00 00 00 00 00 00 00 00 00 00 00 00 00 00    ................
20: 00 00 00 00 00 ff f0 ff f0 00 0f f0 00 00 0f 00    ......?.?.??..?.
30: 21 00 f7 f0 f0 00 00 00 00 00 00 00 00 00 04 06    !.???.........??
40: 10 00 00 00 00 00 00 00 00 00 00 00 00 00 00 00    ?...............
50: 00 00 00 00 00 00 00 00 00 00 00 00 00 00 00 00    ................
60: 00 00 00 00 00 00 00 00 00 00 00 00 00 00 00 00    ................
70: 00 00 00 00 00 00 00 00 00 00 00 00 00 00 00 00    ................
80: 00 00 00 00 00 00 00 00 00 00 00 00 00 00 00 00    ................
90: 00 00 00 00 00 00 00 00 00 00 00 00 00 00 00 00    ................
a0: 00 00 00 00 00 81 00 f0 00 84 ff 01 84 00 00 07    .....?.?.?.??..?
b0: 00 00 00 00 00 00 00 00 00 00 00 00 00 00 00 00    ................
c0: 00 00 00 00 00 00 00 00 00 00 00 00 00 00 00 00    ................
d0: 00 00 00 00 00 00 00 00 00 00 00 00 00 00 00 00    ................
e0: 00 00 00 00 00 00 00 00 00 00 00 00 00 00 00 00    ................
f0: 00 00 00 00 00 00 00 00 00 00 00 00 00 00 02 09    ..............??
root@m1120-c46ab:~# i2cdump -y -a -f 6 0x30
No size specified (using byte-data access)
     0  1  2  3  4  5  6  7  8  9  a  b  c  d  e  f    0123456789abcdef
00: 10 00 00 00 ff 73 0f ff ff ff ff 00 00 00 00 00    ?....s?.........
10: 00 00 00 00 00 00 00 00 00 64 06 1e 00 0f 02 00    .........d??.??.
20: 00 00 00 00 00 00 00 00 00 00 00 00 00 00 00 00    ................
30: 00 00 00 00 2d 90 00 00 00 00 f0 00 00 00 00 00    ....-?....?.....
40: 10 00 00 00 00 00 00 00 00 00 00 00 00 00 00 00    ?...............
50: 10 04 02 0d 01 00 00 00 00 00 1a 04 17 06 00 00    ?????.....????..
60: 10 00 02 18 01 00 00 00 00 00 1a 04 17 06 00 00    ?.???.....????..
70: 00 00 00 00 00 00 00 00 00 00 00 00 00 00 00 00    ................
80: 00 00 00 00 00 00 00 00 00 00 00 00 00 00 00 00    ................
90: 00 00 00 00 00 00 00 00 00 00 00 00 00 00 00 00    ................
a0: 00 00 00 00 00 00 31 00 d1 00 00 00 00 00 00 00    ......1.?.......
b0: 00 00 00 00 00 00 00 00 00 00 00 00 00 00 00 00    ................
c0: 0c e4 cc 43 34 33 41 42 00 00 00 00 00 00 00 00    ???C43AB........
d0: 00 00 00 00 00 00 00 00 00 00 00 00 00 00 00 00    ................
e0: 00 00 00 00 00 00 00 00 00 00 00 00 00 00 00 00    ................
f0: cd 1f 1f 00 00 00 00 00 00 00 00 00 00 00 02 0a    ???...........??