Sled1
root@m1120-c46ab:/var/wcs/home# i2cdump -y -f 15 0x60
No size specified (using byte-data access)
     0  1  2  3  4  5  6  7  8  9  a  b  c  d  e  f    0123456789abcdef
00: 34 01 01 0f 03 00 00 00 0c c3 09 ff 1b 00 00 00    4????...???.?...
10: bf b6 6b f8 ff ff fe b7 9f 0f 00 00 00 00 00 00    ??k?..????......
20: 63 4c 9e ce 7f 0d 00 00 fe 1f 00 00 00 00 00 00    cL????..??......
30: 00 00 f9 0b 00 00 00 00 00 00 00 00 00 00 00 00    ..??............
40: 10 00 00 00 00 00 00 00 00 00 00 00 00 00 00 00    ?...............
50: 00 00 00 00 00 00 00 00 00 00 00 00 00 00 00 00    ................
60: 00 00 00 00 00 00 00 00 00 00 00 00 00 00 00 00    ................
70: 00 00 00 00 00 00 00 00 00 00 00 00 00 00 00 00    ................
80: 00 00 00 00 00 00 00 00 00 00 00 00 00 00 00 00    ................
90: 00 00 00 00 00 00 00 00 00 00 00 00 00 00 00 00    ................
a0: 00 00 00 00 00 00 00 00 00 00 00 00 00 00 00 00    ................
b0: 00 00 00 00 00 00 00 00 00 00 00 00 00 00 00 00    ................
c0: 00 00 00 00 00 00 00 00 00 00 00 00 00 00 00 00    ................
d0: 00 00 00 00 00 00 00 00 00 00 00 00 00 00 00 00    ................
e0: 00 00 00 00 00 00 00 00 00 00 00 00 00 00 00 00    ................
f0: 00 03 04 00 05 16 25 00 00 00 00 00 00 00 00 00    .??.??%.........
root@m1120-c46ab:/var/wcs/home# i2cdump -y -f 5 0x30
No size specified (using byte-data access)
     0  1  2  3  4  5  6  7  8  9  a  b  c  d  e  f    0123456789abcdef
00: 00 00 c3 0c 03 80 00 03 00 ff fe 00 00 fc 00 00    ..????.?..?..?..
10: ff 40 fe 40 ff ff 00 00 00 00 00 00 00 00 00 00    .@?@............
20: 00 00 00 00 00 00 00 00 00 00 00 00 00 03 0f 00    .............??.
30: 00 00 00 00 00 00 00 00 00 00 00 00 00 00 00 00    ................
40: 00 00 00 00 00 00 00 00 00 00 00 00 00 00 00 00    ................
50: 3f 00 00 00 00 00 00 00 00 00 00 00 00 00 00 00    ?...............
60: e0 00 00 df 00 00 67 f9 ff ff fc 00 00 00 00 00    ?..?..g?..?.....
70: 00 00 00 00 00 00 00 00 f0 00 00 00 00 00 7b 00    ........?.....{.
80: 00 cf 00 00 e0 00 00 40 00 00 00 00 00 00 00 00    .?..?..@........
90: 00 00 00 00 00 00 00 80 02 20 00 00 80 00 01 48    .......?? ..?.?H
a0: 4c 90 40 55 fc 19 c0 00 03 00 66 00 fe 01 00 00    L?@U???.?.f.??..
b0: 10 00 00 00 00 00 00 00 00 00 00 00 00 00 00 00    ?...............
c0: 00 00 00 00 00 00 00 00 00 00 00 00 00 00 00 00    ................
d0: 00 00 00 00 69 00 00 fe 00 00 00 00 00 00 00 00    ....i..?........
e0: 00 00 00 00 00 00 00 00 00 00 00 00 00 00 00 00    ................
f0: 00 00 00 00 00 00 00 00 00 00 00 00 00 00 02 09    ..............??
root@m1120-c46ab:/var/wcs/home# i2cdump -y -f 5 0x31
No size specified (using byte-data access)
     0  1  2  3  4  5  6  7  8  9  a  b  c  d  e  f    0123456789abcdef
00: 00 05 10 0c 01 00 00 00 00 00 00 00 00 00 00 00    .????...........
10: 00 00 00 00 00 00 00 00 00 00 00 00 00 00 00 00    ................
20: 00 00 00 00 00 ff 00 ff 00 f0 ff 00 f0 f0 0f 00    .........?..???.
30: 01 00 f7 f0 f0 00 00 00 00 00 00 00 00 00 04 06    ?.???.........??
40: 10 00 00 00 00 00 00 00 00 00 00 00 00 00 00 00    ?...............
50: 00 00 00 00 00 00 00 00 00 00 00 00 00 00 00 00    ................
60: 00 00 00 00 00 00 00 00 00 00 00 00 00 00 00 00    ................
70: 00 00 00 00 00 00 00 00 00 00 00 00 00 00 00 00    ................
80: 00 00 00 00 00 00 00 00 00 00 00 00 00 00 00 00    ................
90: 00 00 00 00 00 00 00 00 00 00 00 00 00 00 00 00    ................
a0: 00 00 00 00 00 80 00 09 00 19 19 01 00 00 00 03    .....?.?.???...?
b0: 00 00 00 00 00 00 00 00 00 00 00 00 00 00 00 00    ................
c0: 00 00 00 00 00 00 00 00 00 00 00 00 00 00 00 00    ................
d0: 00 00 00 00 00 00 00 00 00 00 00 00 00 00 00 00    ................
e0: 00 00 00 00 00 00 00 00 00 00 00 00 00 00 00 00    ................
f0: 00 00 00 00 00 00 00 00 00 00 00 00 00 00 02 08    ..............??
root@m1120-c46ab:/var/wcs/home# i2cdump -y -f 6 0x30
No size specified (using byte-data access)
     0  1  2  3  4  5  6  7  8  9  a  b  c  d  e  f    0123456789abcdef
00: 10 00 00 00 ff 33 0f ff ff ff 03 00 00 00 00 00    ?....3?...?.....
10: 00 00 00 00 00 00 00 00 00 64 07 1e 00 0f 02 00    .........d??.??.
20: 00 00 00 00 00 00 00 00 00 00 00 00 00 00 00 00    ................
30: 00 00 00 00 17 50 00 00 00 00 f0 00 00 00 00 00    ....?P....?.....
40: 10 00 00 00 00 00 00 00 00 00 00 00 00 00 00 00    ?...............
50: 10 00 01 18 01 00 00 00 00 00 1a 02 0a 03 00 00    ?.???.....????..
60: 10 00 01 1a 01 00 00 00 00 00 1a 02 0a 03 00 00    ?.???.....????..
70: 00 00 00 00 00 00 00 00 00 00 00 00 00 00 00 00    ................
80: 00 00 00 00 00 00 00 00 00 00 00 00 00 00 00 00    ................
90: 00 00 00 00 00 00 00 00 00 00 00 00 00 00 00 00    ................
a0: 00 00 00 00 00 00 01 00 42 00 00 00 00 00 00 00    ......?.B.......
b0: 00 00 00 00 00 00 00 00 00 00 00 00 00 00 00 00    ................
c0: 0c e4 cc 43 34 33 41 42 00 00 00 00 00 00 00 00    ???C43AB........
d0: 00 00 00 00 00 00 00 00 00 00 00 00 00 00 00 00    ................
e0: 00 00 00 00 00 00 00 00 00 00 00 00 00 00 00 00    ................
f0: cd 1f 1f 00 00 00 00 00 00 00 00 00 00 00 02 09    ???...........??

Sled2
root@m1120-c46ab:/var/wcs/home# i2cdump -y -f 15 0x60
No size specified (using byte-data access)
     0  1  2  3  4  5  6  7  8  9  a  b  c  d  e  f    0123456789abcdef
00: 34 01 01 0f 03 00 00 00 52 4f 09 ff 23 00 00 00    4????...RO?.#...
10: bf b6 6b f8 ff ff fe b7 9f 0f 00 00 00 00 00 00    ??k?..????......
20: 64 4c 9e cf 7f 0d 00 00 fe 1f 00 00 00 00 00 00    dL????..??......
30: 00 00 f9 0b 00 00 00 00 00 00 00 00 00 00 00 00    ..??............
40: 10 00 00 00 00 00 00 00 00 00 00 00 00 00 00 00    ?...............
50: 00 00 00 00 00 00 00 00 00 00 00 00 00 00 00 00    ................
60: 00 00 00 00 00 00 00 00 00 00 00 00 00 00 00 00    ................
70: 00 00 00 00 00 00 00 00 00 00 00 00 00 00 00 00    ................
80: 00 00 00 00 00 00 00 00 00 00 00 00 00 00 00 00    ................
90: 00 00 00 00 00 00 00 00 00 00 00 00 00 00 00 00    ................
a0: 00 00 00 00 00 00 00 00 00 00 00 00 00 00 00 00    ................
b0: 00 00 00 00 00 00 00 00 00 00 00 00 00 00 00 00    ................
c0: 00 00 00 00 00 00 00 00 00 00 00 00 00 00 00 00    ................
d0: 00 00 00 00 00 00 00 00 00 00 00 00 00 00 00 00    ................
e0: 00 00 00 00 00 00 00 00 00 00 00 00 00 00 00 00    ................
f0: 00 03 04 00 05 16 25 00 00 00 00 00 00 00 00 00    .??.??%.........
root@m1120-c46ab:/var/wcs/home# i2cdump -y -f 5 0x30
No size specified (using byte-data access)
     0  1  2  3  4  5  6  7  8  9  a  b  c  d  e  f    0123456789abcdef
00: 00 00 c3 0d 03 80 00 03 00 ff fe 00 00 fc 00 00    ..????.?..?..?..
10: ff 40 fe 40 ff ff 00 00 00 00 00 00 00 00 00 00    .@?@............
20: 00 00 00 00 00 00 00 00 00 00 00 00 00 03 0f 00    .............??.
30: 00 00 00 00 00 00 00 00 00 00 00 00 00 00 00 10    ...............?
40: 00 00 00 00 00 00 00 00 00 00 00 00 00 00 00 00    ................
50: 3f 00 00 00 00 00 00 00 00 00 00 00 00 00 00 00    ?...............
60: 20 00 00 df 00 00 67 f9 ff ff fc 00 00 00 00 00     ..?..g?..?.....
70: 00 00 00 00 00 00 00 00 f0 00 00 00 00 00 7f 00    ........?.....?.
80: 00 cf 00 00 e0 00 00 40 00 00 00 00 00 00 00 00    .?..?..@........
90: 94 00 00 00 00 00 00 80 02 20 00 00 80 00 00 48    ?......?? ..?..H
a0: 46 90 40 55 fc 17 c0 00 03 00 66 00 7d 01 00 00    F?@U???.?.f.}?..
b0: 10 00 00 00 00 00 00 00 00 00 00 00 00 00 00 00    ?...............
c0: 00 00 00 00 00 00 00 00 00 00 00 00 00 00 00 00    ................
d0: 00 00 00 00 69 00 00 fe 00 00 00 00 00 00 00 00    ....i..?........
e0: 00 00 00 00 00 00 00 00 00 00 00 00 00 00 00 00    ................
f0: 00 00 00 00 00 00 00 00 00 00 00 00 00 00 02 09    ..............??
root@m1120-c46ab:/var/wcs/home# i2cdump -y -f 5 0x31
No size specified (using byte-data access)
     0  1  2  3  4  5  6  7  8  9  a  b  c  d  e  f    0123456789abcdef
00: 00 00 32 0d 01 00 00 00 00 00 00 00 00 00 00 00    ..2??...........
10: 00 00 00 00 00 00 00 00 00 00 00 00 00 00 00 00    ................
20: 00 00 00 00 00 ff 00 ff 00 f0 ff 00 f0 f0 0f 00    .........?..???.
30: 01 00 f7 f0 f0 00 00 00 00 00 00 00 00 00 04 04    ?.???.........??
40: 10 00 00 00 00 00 00 00 00 00 00 00 00 00 00 00    ?...............
50: 00 00 00 00 00 00 00 00 00 00 00 00 00 00 00 00    ................
60: 00 00 00 00 00 00 00 00 00 00 00 00 00 00 00 00    ................
70: 00 00 00 00 00 00 00 00 00 00 00 00 00 00 00 00    ................
80: 00 00 00 00 00 00 00 00 00 00 00 00 00 00 00 00    ................
90: 00 00 00 00 00 00 00 00 00 00 00 00 00 00 00 00    ................
a0: 00 00 00 00 00 80 00 be 00 00 17 03 00 00 00 01    .....?.?..??...?
b0: 00 00 00 00 00 00 00 00 00 00 00 00 00 00 00 00    ................
c0: 00 00 00 00 00 00 00 00 00 00 00 00 00 00 00 00    ................
d0: 00 00 00 00 00 00 00 00 00 00 00 00 00 00 00 00    ................
e0: 00 00 00 00 00 00 00 00 00 00 00 00 00 00 00 00    ................
f0: 00 00 00 00 00 00 00 00 00 00 00 00 00 00 02 08    ..............??
root@m1120-c46ab:/var/wcs/home# i2cdump -y -f 6 0x30
No size specified (using byte-data access)
     0  1  2  3  4  5  6  7  8  9  a  b  c  d  e  f    0123456789abcdef
00: 10 00 00 00 ff 00 00 00 00 00 00 00 00 00 00 00    ?...............
10: 00 00 00 00 00 00 00 00 00 00 00 00 00 0f 00 00    .............?..
20: 00 00 00 00 00 00 00 00 00 00 00 00 00 00 00 00    ................
30: 00 00 00 00 18 10 00 00 00 00 f0 00 00 00 00 00    ....??....?.....
40: 10 00 00 00 00 00 00 00 00 00 00 00 00 00 00 00    ?...............
50: 10 00 01 f6 01 00 00 00 00 00 1a 02 0a 03 00 00    ?.???.....????..
60: 10 00 01 f8 01 00 00 00 00 00 1a 02 0a 03 00 00    ?.???.....????..
70: 00 00 00 00 00 00 00 00 00 00 00 00 00 00 00 00    ................
80: 00 00 00 00 00 00 00 00 00 00 00 00 00 00 00 00    ................
90: 00 00 00 00 00 00 00 00 00 00 00 00 00 00 00 00    ................
a0: 00 00 00 00 00 00 01 00 2b 00 00 00 00 00 00 00    ......?.+.......
b0: 00 00 00 00 00 00 00 00 00 00 00 00 00 00 00 00    ................
c0: 0c e4 cc 43 34 33 41 42 00 00 00 00 00 00 00 00    ???C43AB........
d0: 00 00 00 00 00 00 00 00 00 00 00 00 00 00 00 00    ................
e0: 00 00 00 00 00 00 00 00 00 00 00 00 00 00 00 00    ................
f0: cd 1f 1f 00 00 00 00 00 00 00 00 00 00 00 02 09    ???...........??
